{
  "event_id": "ffffffff-ffff-4fff-8fff-ffffffffffff",
  "event_type": "agent.release.published",
  "schema_version": 1,
  "workspace_id": "11111111-1111-4111-8111-111111111111",
  "aggregate_id": "55555555-5555-4555-8555-555555555555",
  "aggregate_version": 1,
  "occurred_at": "2026-08-13T08:00:00Z",
  "trace_id": "0123456789abcdef0123456789abcdef",
  "payload": { "release_version": 1 }
}
